Unnamed: 0,comments,Service,clean_sentence,sentiment,cluster,nb_mots,x,y
854,Au moins un dépôt pour acheter poulet,Orange Money,dépôt acheter poulet,POSITIVE,0,3,-0.05979465329983212,-0.02893200157370156
855,Bonne fête,Orange Money,bon fête,POSITIVE,0,2,-0.06019358523329093,-0.02949750832849118
857,Svp comment savoir que votre puce à été identifié ou pas,Orange Money,svp savoir puce être identifier,NEUTRAL,0,5,-0.05712974958496551,-0.02622140434424524
858,J’ai mon wifi qui est fini et je n’ai pas d’argent pour le réabonnement pouvez vous réglé mon abonnement à l’occasion de la fêtes des pères ??,Orange Money,wifi finir argent réabonnement pouvoir régler abonnement occasion fête père,NEGATIVE,0,10,-0.056659816798484065,-0.023371086955412748
859,Orange merci j'ai pas puce orange mais a partir de aujourd'hui j'achète puce orange,Orange Money,orange puce oranger partir acheter puce oranger,NEGATIVE,0,7,-0.09377387132504593,0.06899444988623551
861,Excellent choix,Orange Money,excellent choix,POSITIVE,0,2,-0.05028318932808457,-0.03144259745811594
862,Je vous les recommande,Orange Money,recommande,POSITIVE,0,1,-0.051871959412641014,-0.03167640228432689
863,Ou j'ai fini de payer pour moi la c'est maintenant vous faites,Orange Money,finir payer fait,NEGATIVE,0,3,-0.052405958936365765,-0.02462310459718422
864,Mais quand 9n pays nos impôts avec Orange Money vous nous prélèvez et le paiement ne passe pas. Vous ne nous ramener pas l'argent aussi et ça reste juste des promesses,Orange Money,pays impôt orange money prélèver paiement passer ramener argent promesse,NEGATIVE,3,10,-0.12941483359385572,0.23856487457688608
865,"Vous m'avez coupé coupé 150 fr pour facture de 1200fr walaye ça brûlé mon cœur mais à cause du geste faite au papa hier lors de la fête des pères, je vous pardonne.",Orange Money,avoir couper couper facture walaye brûler cœur cause geste faire papa hier fête père pardonner,NEGATIVE,0,15,-0.057491065799283265,-0.032870117738135134
866,Je peut me lancé tout de suite?,Orange Money,lancer suite,POSITIVE,0,2,-0.05169521095345483,-0.030327946990487475
867,C'est sécurisé?,Orange Money,sécuriser,NEGATIVE,0,1,-0.05236834930534695,-0.02352636882710758
868,"Nonis Gnepa
Ornella Ouonde
Magdala Akominù Souliatou
Fatima Coulibaly
Daa Niee
Guy Arnaud Montson
Samira Diabaté
Grâce Naomi Fieni
Abdoul Diéné
Il y’a Mouton gratuit hein
Vous dormez ?",Orange Money,nonis gnepa ornella ouonde magdala akominù souliatou fatima coulibaly daa niee guy arnaud montson samira diabaté grâce naomi fieni abdoul diéné mouton gratuit hein dormir,NEGATIVE,0,25,-0.052614321008312086,-0.030334416148929604
869,Un vrai Dohi,Orange Money,vrai dohi,POSITIVE,0,2,-0.06243465407596289,-0.03383389823213064
870,Orange c'est dohi,Orange Money,orange dohi,NEUTRAL,3,2,-0.10833915024112624,0.14525793539526063
871,C'est de la discrimination des personnes qui ont déjà l'argent de mouton on gagne des moutons dieu vous voir,Orange Money,discrimination personne argent mouton gagner mouton dieu voir,NEGATIVE,0,8,-0.056888590757183895,-0.024845048752234707
872,Félicitations !!!,Orange Money,félicitation,POSITIVE,0,1,-0.05752810791761498,-0.02803812318292171
873,Bravo à orange,Orange Money,bravo orange,POSITIVE,3,2,-0.12855578282903468,0.22537597648001734
874,Y’a pas dohi dedans ohh,Orange Money,dohi ohh,NEUTRAL,0,2,-0.06194378201498499,-0.03270747400292221
875,Félicitations,Orange Money,félicitations,POSITIVE,0,1,-0.054190084136451204,-0.026767400539318476
877,"Aujourd'hui es mon anniversaire
Dohi tala",Orange Money,anniversaire dohi tala,POSITIVE,0,3,-0.058693596347569495,-0.026213432931266087
878,"Au moins les moutons on eu de la chance,de passer à la télé avant le drame.",Orange Money,mouton chance passer télé drame,NEGATIVE,0,5,-0.05644080648855612,-0.03484093288618825
879,"Orange, j'ai rechargé mon compte yango depuis hier a 19h17 mais mon compte n'a pas été crédité je fais réclamation et c'est sans suite",Orange Money,orange recharger compte yango hier compte être créditer réclamation suite,POSITIVE,0,10,-0.08057101565005953,0.05852382322583215
880,Je sais les mêmes travail de orange ki gagne,Orange Money,savoir travail orange gagne,POSITIVE,3,4,-0.09162683091270422,0.13177826114146327
882,Avec Orange Dohi Tala !!,Orange Money,orange dohi tala,NEUTRAL,0,3,-0.09465989838478228,0.09404860441322999
883,Sais dohi,Orange Money,sais dohi,NEUTRAL,0,2,-0.0661930093328694,-0.0313701358930711
884,La pub qui contraste avec la réalité,Orange Money,pub contraste réalité,POSITIVE,0,3,-0.0533244539224056,-0.03350480822865332
885,Sara là même c'est quoi,Orange Money,sara,POSITIVE,0,1,-0.05334638034118588,-0.033277577576895485
886,"Orange Money
C'est Jonathan dans les ""apprentis aventuriers "" sur M6. Il avait pour "" co-apprenti "" Joyce.
Donc, le mec est ivoirien ?",Orange Money,orange money jonathan apprenti aventurier joyce mec ivoirien,POSITIVE,3,8,-0.1470299975029984,0.3248833930885732
887,C'est pour acheter le serpent,Orange Money,acheter serpent,POSITIVE,0,2,-0.0540362026367511,-0.03215748859713585
888,Jason Derulo de Koumassi.,Orange Money,jason derulo koumassi,NEUTRAL,0,3,-0.05281547876482403,-0.03238909614858592
889,"Je suis extrêmement déçue du service Orange Money. J’ai effectué par erreur un transfert d’argent et depuis, impossible d’annuler l’opération. Aucun numéro clair pour joindre le service client, aucune solution concrète, juste un historique qui ne sert à rien.
Comment est-il acceptable qu’un service aussi sensible que la gestion d’argent ne prévoie aucun recours simple pour les erreurs humaines ?
J’attends une réponse rapide et une prise en charge sérieuse de ma réclamation. Merci de me contacter en urgence.",Orange Money,extrêmement décevoir service orange money effectuer erreur transfert argent impossible annuler opération aucun numéro clair joindre service client aucun solution concret historique servir rien acceptable service sensible gestion argent prévoir aucun recours simple erreur humain attend réponse rapide prise charge sérieux réclamation contacter urgence,NEGATIVE,0,44,-0.09123594691121907,0.07942178171504087
890,"Objet : Plainte pour erreur de transfert Orange Money vers un numéro incorrect
Madame, Monsieur,
Je me permets de vous adresser la présente réclamation suite à une erreur survenue lors d’un transfert d’argent effectué via votre service Orange Money.
Détails de la transaction :
• Date et heure du transfert : [16/05/2025 à 17H 24]
• Montant transféré : [72.000 fcfa]
• Numéro de téléphone du destinataire erroné : [+221 7 76 77 77 08]
• Numéro de téléphone de l’émetteur : [0707817973]
Je sollicite votre intervention pour geler cette transaction et procéder au remboursement du montant transféré vers le numéro erroné. Je reste à votre disposition pour fournir toute information ou document supplémentaire nécessaire à la résolution de ce problème.
Je tiens à préciser qu'une réclamation au call center a été effectué le même jour mais jusque là est resté sans suite. Je vous exprime mon mécontentement et j'ose espérer que dans un bref délais une suite favorable me sera communiquée au risque de me voir rendre cette réclamation virale.
Dans l’attente de votre retour,
Cordialement,
MEITE ABDRAMANE
0707817973",Orange Money,objet plainte erreur transfert orange money numéro incorrect monsieur monsieur permettre adresser présent réclamation suite erreur survenir transfert argent effectuer service orange money détails transaction date heure transfert montant transférer fcfa numéro téléphone destinataire erroner numéro téléphone émetteur solliciter intervention geler transaction procéder remboursement montant transférer numéro erroner disposition fournir information document supplémentaire nécessaire résolution problème préciser réclamation call center être effectuer jour rester suite exprimer mécontentement ose espérer bref délai suite favorable communiquer risque voir réclamation viral attente cordialement meite abdramane,NEGATIVE,3,82,-0.09771214572927597,0.1280236632711883
891,"MERCI, PAREILLEMENT À VOUS",Orange Money,pareillement,POSITIVE,0,1,-0.051871959412641014,-0.03167640228432689
893,Bâton non non,Orange Money,bâton non non,NEGATIVE,0,3,-0.05570125148311968,-0.03138616240839108
894,Ils se demandent comment faire pour me digue ils trafiquent des plans et encore ils dorment et pendant ils sont couchés dort moi je suis toujours entrain de trafiqué mes plans.....,Orange Money,demander faire digue trafiquer plan dormir couché dort entrain trafiqué plan,NEGATIVE,0,11,-0.054101741235206044,-0.0366621140986077
895,J étais a l université quand j étais au collège,Orange Money,université collège,POSITIVE,0,2,-0.0532376656166336,-0.03312425665360824
896,Encore no1 j ai laipai j ai gor,Orange Money,laipai gor,POSITIVE,0,2,-0.051871959412641014,-0.03167640228432689
897,Je garde ma puce orange pour toujours,Orange Money,garde puce oranger,POSITIVE,0,3,-0.06876986097159554,-0.014958354818030454
898,Encaisse,Orange Money,encaisse,NEUTRAL,0,1,-0.051871959412641014,-0.03167640228432689
899,Une fois,Orange Money,fois,POSITIVE,0,1,-0.05359044322079378,-0.027760439931677656
900,"verser les machettes les ultras. C'est Orange nous on kiff
Je viens d'acheter un Lambo Urus.. farotela (bow)
On signe plus contrat sans avocat oh... Arodela ( chetté)",Orange Money,verser machette ultra orange kiff venir acheter lambo urus farotela bow signe contrat avocat arodela chetté,NEGATIVE,0,16,-0.0809553041946507,0.07145683447198191
901,Demain je vais acheter une nouvelle puce Orange encore...,Orange Money,demain acheter nouveau puce orange,POSITIVE,0,5,-0.08647968101750374,0.08570487924766079
902,"<J’étais à l’université quand j’étais au collège >
<C moi je vais tomber la pluie donc pas la peine de se doucher>
Straaa straaa",Orange Money,université collège tomber pluie peine doucher straaa straaa,NEGATIVE,0,8,-0.055444979504679845,-0.03259694880335818
903,Il faut que je sorte un projet pour me détrôner moi même.,Orange Money,falloir sortir projet détrôner,NEGATIVE,0,4,-0.04755412588653896,-0.024774093282905082
904,Aok je vais faire un dépôt,Orange Money,aok faire dépôt,POSITIVE,0,3,-0.06363012261306275,-0.03578483639116044
905,C’est moi qui fait tombé la pluie donc c’est pas la peine de se doucher,Orange Money,tomber pluie peine doucher,NEGATIVE,0,4,-0.05526544393954457,-0.031803172978228676
906,"Debalous sa, entré dévaliser,, avec atalaku sa, tu peux pas rivaliser (fort que fort
)",Orange Money,debalous entrer dévaliser atalaku rivaliser fort fort,NEGATIVE,0,7,-0.06664131616582625,-0.04580462973671064
907,"Le meilleur réseau
une fois",Orange Money,meilleur réseau fois,POSITIVE,0,3,-0.06741709931982842,0.016034897208089816
908,On avait pas vu désolé orange on est tellement ignoré qu' on s attendait pas a ce qu un gros nom nous fasse un clin d' oeil.,Orange Money,désolé oranger ignorer attendre gros nom faire clin oeil,NEUTRAL,0,9,-0.060195160400153394,-0.0297920635058212
909,S ils veulent commencer la guérilla on va employer la plus forte des manières,Orange Money,vouloir commencer guérilla employer fort manière,POSITIVE,0,6,-0.060282897645648544,-0.04900576156423249
910,Mon réseaux,Orange Money,réseau,POSITIVE,0,1,-0.07294966485260604,0.002674583719831987
911,Mon compte est bloqué.,Orange Money,compte bloquer,NEGATIVE,0,2,-0.05789963422926293,-0.01729469960921326
912,La fête des mères approche !,Orange Money,fête mère approch,POSITIVE,0,3,-0.054719937352294676,-0.0324004024525377
913,"Orange Bank CI
, Orange ci , meilleur des meilleurs",Orange Money,orange bank orange meilleur meilleur,POSITIVE,3,5,-0.1099780661835495,0.21713002944757506
914,J'adore les fleurs je peux maintenant m'offrir des fleurs avec Orange money en sécurité.,Orange Money,adorer fleur offrir fleur orange money sécurité,POSITIVE,3,7,-0.15622817974377157,0.35320916698373866
915,La dame est trop belle,Orange Money,dame trop bel,POSITIVE,0,3,-0.05553665585324621,-0.04231378156851101
916,"Orange Money CI, c'est Top!",Orange Money,orange money top,POSITIVE,3,3,-0.16022613641079783,0.38469140816985903
917,"Bonjour madame
Si 'nous avons une surprise à faire
Peut on avoir un contacte ?",Orange Money,bonjour monsieur surprise faire contacte,POSITIVE,0,5,-0.05278719839937207,-0.03230419373529077
918,Les gérants des PDV exigent 100 f pour toutes opérations Orange money. C'est normal ???,Orange Money,gérant pdv exiger opération orange money normal,NEUTRAL,3,7,-0.1196872594522658,0.23348354077074682
920,Tu es problème Orange,Orange Money,problème orange,NEGATIVE,3,2,-0.14166737559960746,0.28251697477475196
921,Besoin d'abonnés svp les amis,Orange Money,besoin abonné svp ami,NEUTRAL,0,4,-0.052093528501025776,-0.043048111722530515
922,Tu trouves le bon aussi on te fait payer les 100f,Orange Money,trouve bon payer,NEUTRAL,0,3,-0.05587514615351944,-0.03220507177194266
923,"Avoir une puce marchande orange money est vraiment très difficile. Depuis plus de six mois. Vos agents bloquent-ils les dossiers à leur guise ?
Que le CM
Orange Money
apporte mon message à la direction, on souffre beaucoup",Orange Money,puce marchand orange money vraiment difficile mois agent bloquer dossier guise orange money apporter message direction souffrir beaucoup,NEGATIVE,3,18,-0.14311967581317556,0.3342522032871237
924,Sciencer on veut supprimer les numéros complices,Orange Money,sciencer vouloir supprimer numéro complice,NEGATIVE,0,5,-0.05385466874698694,-0.03247695745464281
925,Mdrrrr,Orange Money,mdrrrr,NEGATIVE,0,1,-0.053950585294098755,-0.03396238777975122
926,"Les couples ou y’a pas OM dedans enlève ton pied
…
Avec OM c’est 0f de frais",Orange Money,couple enlever pied frais,NEGATIVE,0,4,-0.05645120023203099,-0.03687521648819977
927,Sale comportement,Orange Money,sale comportement,NEUTRAL,0,2,-0.05447593413021673,-0.030453787034329556
928,"Walaye trop doux même avec +454 j'ai plus de stress plus de maladie je suis épanouie
jusqu'à j'ai honte",Orange Money,walaye trop doux stress maladie épanoui honte,NEGATIVE,0,7,-0.05516102925069443,-0.03706970314218578
929,"S'il n'a pas OM c'est que c'est pas le bon, c'est un coulé-liquidé.
OM c'est pour les kélépé 1 et non les prinprins.",Orange Money,bon couler liquidé kélépé non prinprin,POSITIVE,0,6,-0.058187231724133204,-0.03417712693977724
930,"Orange Money
je veux mon argent svp, depuis ce matin je n'ai pas accès à mon coffre fort sur max it.
Pfff",Orange Money,orange money vouloir argent svp matin accès coffre fort max pfff,NEGATIVE,3,11,-0.1174953909044917,0.1683884171348803
931,Tu es le problème mon fils,Orange Money,problème fils,NEGATIVE,0,2,-0.06086219253055798,-0.024228706834411848
932,"Love comment même
Ne ns mettez pas dans blême hein",Orange Money,lover mettre blême hein,POSITIVE,0,4,-0.053119464296690386,-0.017458139286746145
933,Comment ils font et les passes coulent comme ça Tchié,Orange Money,passe couler tchié,NEGATIVE,0,3,-0.05228520896199869,-0.03245240961418957
934,L'adversaire partage l'argent ici vous vous faites poète Ok,Orange Money,adversaire partage argent ici fait poète,NEUTRAL,0,6,-0.06512764721459197,-0.022782468402347367
935,Tiktak mon problème actuellement...,Orange Money,tiktak problème actuellement,NEGATIVE,0,3,-0.05612153182035377,-0.02224449433593485
936,"Ce Monsieur impose aux gens de payer des surplus pour effectuer des retraits. Quand tu veux un retrait de 10.000 FCFA par exemple il demande de composée 10300 FCFA
Voici son code et nom.
ERNARD SARL 117214
Ce sont des gens à retirer du circuit
Allez à Mvan à Yaoundé, tous font ça. Il faut retirer ces gens sinon vous allez perdre gros",Orange Money,monsieur impos payer surplus effectuer retrait veux retrait fcfa exemple demande composer fcfa code nom ernard sarl retirer circuit allez mvan yaoundé falloir retirer aller perdre gros,NEGATIVE,0,27,-0.05651583808653946,-0.025787385142255134
937,"Orange Money
j'ai acheté une puce a l'agence je les fait identifié ils m'ont dit il avait un problème de réseau pour créé qu'après je devais faire le #144*71# pour ouvrir mon compte mais depuis rien ne passe ça fait presque 1 mois maintenant c'est dû a quoi?",Orange Money,orange money acheter puce agence identifier problème réseau créer devoir faire ouvrir compte rien passer presque mois,NEGATIVE,3,17,-0.1146966173781932,0.1582765646638719
938,"Bonjour je vous ai laissé un message inbox, j’ai besoin que vous traiter ma requête svp ! Merci",Orange Money,bonjour laisser message inbox besoin traiter requête svp,NEGATIVE,0,8,-0.05532489475302672,-0.029542588427646798
939,"Ste Christy
de parler ?",Orange Money,ste christy,POSITIVE,0,2,-0.051871959412641014,-0.03167640228432689
940,"Bonjour orange Côté d’ivoire ! J’ai un souci avec mon coffre fort bloqué de Max it! Je n’arrive pas à y accéder, on me mer erreur, je ne peux même plus y déposer de l’argent ! J’ai appelé le service client, on m’a dit que la demande sera traitée sous 48h depuis rien ! Svp veuillez régler mon problème, j’ai de l’argent dessus, pfff….",Orange Money,bonjour oranger côté ivoir souci coffre fort bloquer max arriver accéder mer erreur déposer argent appeler service client demande traiter rien svp vouloir régler problème argent pfff,NEGATIVE,0,27,-0.07419924356267671,-0.015741275866676955
941,Arrêtez de voler les gens ...,Orange Money,arrêtez voler,NEGATIVE,0,2,-0.05270507293911407,-0.02481920754615064
943,On a compris mais quand on veut aller retirer aussi ya manque pae on doit payer frais,Orange Money,vouloir aller retirer manque pae payer frais,NEGATIVE,0,7,-0.05758736744543673,-0.03928400411209742
944,"Anaki Serge
il ne paye jamais les frais tu es problème même",Orange Money,anaki serge payer jamais frais problème,NEGATIVE,0,6,-0.06589286085054515,-0.01761347678372649
945,Votre application ou on vo?le l'argent des gens là tchrrrr,Orange Money,application argent tchrrrr,NEUTRAL,0,3,-0.061779739883310376,-0.014318639078693454
946,"Vous même on souscrit passe internet ça finit vite et puis vous pensez que vous êtes les bons ???
vous faites les faux wé meme",Orange Money,souscrire passer internet finir vite penser être bon fait faux,NEGATIVE,0,10,-0.0629042170522298,-0.019739320078647076
947,"Toi CM là, t’aime amusement façon,
Nos passes million qui finissent vite là, tu n’en parles pas hein",Orange Money,aime amusement passe finir vite parle hein,POSITIVE,0,7,-0.04905361663715757,-0.014345960696310585
948,Je te dis,Orange Money,dire,POSITIVE,0,1,-0.044935555046703914,-0.03226414333129781
949,"bonjour
Orange
, impossible d'avoir accès à mon coffre depuis l'application Max It, comment puis-je remédier à cela?",Orange Money,bonjour orange impossible accès coffre application max remédier,NEGATIVE,0,8,-0.08124468340338006,0.06712865230426908
950,Moi même je vous attends au tournant OM,Orange Money,attend tournant,NEUTRAL,0,2,-0.03975555537410481,-0.054716899124286004
951,"C’est un gaou
.",Orange Money,gaou,NEUTRAL,0,1,-0.051871959412641014,-0.03167640228432689
952,"Bonjour j’ai une question ?
Pour effectuer une transaction orange de la Côte d’Ivoire à la Côte d’Ivoire
Il faut obligatoirement la application orange money ou non merci et bonne journée",Orange Money,bonjour question effectuer transaction oranger côte ivoire côte ivoire falloir obligatoirement application oranger money non bon journée,NEGATIVE,1,17,0.18250938658002366,0.16335865835287258
953,Tu paies ton crédit pour avoir un autre prêt c'est difficile pfffffffff,Orange Money,paie crédit prêt difficile pfffffffff,NEGATIVE,0,5,-0.04820892236531837,-0.03399402759726772
954,Lollllllll,Orange Money,lollllllll,NEGATIVE,0,1,-0.051871959412641014,-0.03167640228432689
955,"Orange Money a des soucis sur son coffre fort depuis 72h l'argent des clients est bloqué, impossible de retirer.",Orange Money,orange money souci coffre fort argent client bloquer impossible retirer,NEGATIVE,3,10,-0.12410297226248766,0.1988046247422711
956,Le coffre fort a quel soucis on peut pas accéder,Orange Money,coffre fort souci accéder,POSITIVE,0,4,-0.06462869581793092,-0.03897395820706918
957,Ehhhh orange pardonnez mon argent j’ai mis dans coffre fort la date est arrivée pour récupérer mon argent c’est dans procedure je trouve pas aider moi ohhhhh,Orange Money,ehhhh oranger pardonner argent mettre coffre fort date arriver récupérer argent procedure trouver aider ohhhhh,NEGATIVE,0,15,-0.0718760492653497,-0.017189411316811284
958,Pendant qu'on rigole moi j'ai envoyé mon CV par erreur à la WWE ; ils m'ont programmé lundi contre JOHN CENA,Orange Money,rigole envoyer erreur wwe programmer lundi contre john cena,NEGATIVE,0,9,-0.0571344887375324,-0.03177422176462154
959,Dieux merci canal boix va nous donner envie de conexte tout le temps 500frs par semaine 24#24 merci beaucoup je mafou de 1go oubien 2go par semaine,Orange Money,dieux canal boix donner envie conexte temps semaine beaucoup mafou oubien semaine,POSITIVE,0,12,-0.04883058096445069,-0.03630329239179481
960,"Chercher à créer, vous aimez trop copié les autres.
Merci et prenez soin de vous.",Orange Money,chercher créer aimer trop copier prendre soin,POSITIVE,0,7,-0.057081997823801404,-0.03459291349178089
961,Timbre de 100F qu'on paye au-delà d'un transfert de 5000F a été supprimé ?,Orange Money,timbre payer transfert être supprimer,NEGATIVE,0,5,-0.06525905578133097,-0.02327487086681192
962,Orange Money veux nous voler maintenant quoi,Orange Money,orange money veux voler,POSITIVE,3,4,-0.16312642653720433,0.4165274946130734
963,Ont reçoit 5450 vous avez oublié les frais de timbre qui s’appliquent pour les dépôt supérieur à 5000,Orange Money,recevoir avoir oublier frais timbre appliquer dépôt supérieur,NEUTRAL,0,8,-0.05566082223648026,-0.0390377315247734
964,Ce qui veut dire que orange a annulé les frais de transfert,Orange Money,vouloir oranger annuler frais transfert,NEGATIVE,0,5,-0.07070220937887967,-0.02832555966668294
965,C'est dohi mtn est le meilleur,Orange Money,dohi mtn meilleur,POSITIVE,0,3,-0.05952419530762577,-0.013984615488073508
966,"10H
BK=
56
SBK=
20
TURBO2=56-20-32 TURBO3=32-40 TURBO4=40-76 TOWSU2=76-21 PERME=56-20-32-40-76-21 BONNE CHANCE",Orange Money,bon chance,POSITIVE,0,2,-0.055007631552485926,-0.035110475641380874
967,Bonsoir moi je veux savoir pourquoi quand on va faire un dépôt ou retrait on paye 100f aux marchands ??,Orange Money,bonsoir vouloir savoir faire dépôt retraire paye marchand,NEUTRAL,0,8,-0.0581166572674838,-0.036349412084557366
968,"S'il vous plaît expliquez les frais de timbre 100f aux clients aussi car ça nous fatigue nous les pdv car d'autres même nous traitent de voleur car pour 5000f nous savons que les frais de retrait c'est 50f c'est à dire 1% mais pour un client qui veut forcément payer les frais pour son récepteur il doit payer 5150f sinon 5050f envoyé le client reçois 4950f
S'il vous plaît aidez-nous",Orange Money,plaire expliquer frais timbre client fatigue pdv traiter voleur savoir frais retrait client vouloir forcément payer frais récepteur payer envoyer client recevoir plaire aider,NEGATIVE,0,24,-0.05906112601500014,-0.03300683343869798
970,C'est dohi vrai dohi,Orange Money,dohi vrai dohi,POSITIVE,0,3,-0.06526048189045869,-0.03317283670274197
971,Hamed tu es de venir vidéo manne,Orange Money,hamed venir vidéo manne,NEGATIVE,0,4,-0.05477664390739246,-0.02746718207303273
972,Vous recevrez la même somme c'est à dire 5550 f parce que les transferts en OM sont gratuits,Orange Money,recevoir somme transfert gratuit,NEUTRAL,0,4,-0.049846408934176085,-0.03608285913359363
973,"Orange je suis pas content de vous celà fait pratiquement 3 semaines j'ai fait une demande de réclamation que vous m'avez prélevé deux fois sur mon compte et jusque là pas de remboursement.
Svp je veux mon l'argent.",Orange Money,orange content celà pratiquemer semaine demande réclamation avoir prélever fois compte remboursement svp vouloir argent,NEGATIVE,0,15,-0.07925900717536027,0.04461659263877319
974,Orange Money revoyez votre question…,Orange Money,orange money revoir question,NEGATIVE,3,4,-0.17573626818970925,0.44706685433773086
975,"Du compte personnel à un autre compte les frais de timbres 100f ne s’applique pas
Les frais de timbres 100f s’applique lorsque vous partez dans un point de vente et est en pratique lorsque l’opération est au delà de 5000f",Orange Money,compte personnel compte frais timbre applique frais timbre applique partir point vente pratique opération,NEUTRAL,0,14,-0.0628202808008426,-0.030942095694507545
976,C’est faux,Orange Money,faux,NEGATIVE,0,1,-0.05466958542274668,-0.031008070662141108
977,Aaaah c'est dohi,Orange Money,aaaah dohi,NEGATIVE,0,2,-0.0661930093328694,-0.0313701358930711
979,Votre maxit qui ne marche jamais.,Orange Money,maxit marche jamais,NEGATIVE,0,3,-0.058520666867576364,-0.026234072828972502
980,"C'est 5450, timbre 100f et après tu reçois les bonus mn,sms et pass internet",Orange Money,timbre recevoir bonus sms pass internet,POSITIVE,0,6,-0.05778972329674333,-0.03605779469731344
981,"Vous dites depôt et différent de transfert d’argent.
Les frais de timbre sont appliqués pour les dépôts supérieurs à 5000frs.
Mais au niveau du transfert d’argent il n’y a pas frais de timbres.",Orange Money,dire depôt transfert argent frais timbre appliquer dépôt supérieur niveau transfert argent frer timbre,NEUTRAL,0,14,-0.06559695543412554,-0.024772342323758304
982,Samasoko aah vieux tu vaurien trop comment même 5040,Orange Money,samasoko aah vieux vaurien trop,NEGATIVE,0,5,-0.057081728048684804,-0.04357913646969028
