Unnamed: 0,comments,Service,clean_sentence,sentiment,cluster,nb_mots,x,y
437,"J'ai reçu ma carte virtuelle Visa. Merci wave.
J'attends maintenant mon gros cadeau.",WAVE,recevoir carte virtuel visa wav attendre gros cadeau,NEUTRAL,2,8,0.051714223397378495,-0.16845078868807575
438,"Wave Côte d'Ivoire
merci beaucoup pour la carte",WAVE,wave côte ivoire beaucoup carte,POSITIVE,1,5,0.49134573234760115,0.06063089844101398
439,On attend pour ECOBANK,WAVE,attendre ecobank,NEGATIVE,0,2,-0.03956753481807185,-0.03761153417956527
440,"Merci
Wave Côte d'Ivoire
pour ma carte Visa troooo content actuellement",WAVE,wave côte ivoire carte visa troooo content actuellement,POSITIVE,1,8,0.523817442571222,-0.03599503555246764
441,"Merci, on ira plus au guichet
Merci à
Wave Côte d'Ivoire
et
Guaranty Trust Bank - Côte D'Ivoire
Good job",WAVE,aller guichet wave côte ivoire guaranty trust bank côte ivoire good job,POSITIVE,1,12,0.33268476144046577,0.12412928573704014
442,Comment transférer de l'argent de NSIA vers wave ?,WAVE,transférer argent nsia wave,NEGATIVE,0,4,0.025723809216301748,-0.02369363915131315
443,"Wave a vie mais svp
Wave Côte d'Ivoire
la carte magnétique est disponible pour quand",WAVE,wave vie svp wave côte ivoire carte magnétique disponible,POSITIVE,1,9,0.35605609213658795,0.031710042829402214
445,"Wave Côte d'Ivoire
la carte prépayée n'est pas encore arrivée à mon niveau hein",WAVE,wave côte ivoire carte prépayer arriver niveau hein,NEUTRAL,1,8,0.357886616884785,0.042174273866750905
446,Wave ne peut pas avoir des guichet automatique comme les autres. Cela nous permettra de faire des retraits à n'importe quelle heure.,WAVE,wave guichet automatique permettre faire retrait heure,POSITIVE,0,7,0.0015465169581919491,-0.03326351522956789
447,Vous êtes les bienvenus et les meilleurs,WAVE,être bienvenu meilleur,POSITIVE,0,3,-0.056933348977776244,-0.0025724025285143812
448,MERCI À WAVE POUR TOUT CE QU ILS FONT POUR LA POPULATION,WAVE,wave population,NEUTRAL,0,2,0.05373170084799851,-0.03505039124748037
449,"Wave Côte d'Ivoire
je voulais savoir si je vous êtes offensé pour que vous me donnez cadeau
ou y'a rien dedans chaque fois je n'es pas de chance dite moi a même temps je vais vous demander pardon heee on peut faire. Merci de bien vouloir me répondre.
En effet il faut aussi reconnaître que vous m'aviez permis de pouvoir économiser pas le coffre merci infiniment de grâce revoyez côté cadeau
hoo",WAVE,wave côte ivoire vouloir savoir être offenser donner cadeau rien fois chance temps demander pardon heee faire bien vouloir répondre falloir reconnaître avoir permettre pouvoir économiser coffre infiniment grâce revoir côté cadeau hoo,NEGATIVE,0,33,0.10439358392781249,0.018833691965133514
450,"Je dis oooh
Votre carte virtuelle là ,
Vous trillez homme , pour donner? Un ces à vos connaissances que vous donner tchai?",WAVE,dire oooh carte virtuel triller homme donner connaissance donner tcher,POSITIVE,2,10,0.01619029750708282,-0.11563798040482934
451,"Merci pour tout, tu nous a vraiment sauvé",WAVE,vraiment sauver,POSITIVE,0,2,-0.0547535937762031,-0.026701559439998097
452,Ma carte visa n'est pas encore activée,WAVE,carte visa activer,POSITIVE,2,3,0.12559097157004392,-0.30136473400468605
453,"Wave
mon préféré",WAVE,wave préféré,POSITIVE,0,2,0.0800114742333025,-0.02997213387405417
454,Il y a des gens qui prennent 100fr au retrait et au dépôt dans N'dotre la ici dès,WAVE,prendre retrait dépôt dotre ici,NEGATIVE,0,5,-0.06181827506697231,-0.03151737850662818
455,Jai reçu ma carte virtuelle il y a quelques jours. J'aimerais savoir si je peux transférer de l'argent à partir de mon compte bancaire sur cette carte ?,WAVE,jai recevoir carte virtuel jour aimer savoir transférer argent partir compte bancaire carte,NEGATIVE,2,13,0.0270041749862098,-0.12386595652555428
457,Wave côte d'Ivoire t’es le meilleur.,WAVE,wave côte ivoire meilleur,POSITIVE,1,4,0.5310870117668413,0.19529070048428082
458,"Merci beaucoup wave
je me suis réveillé se matin
Ma carte visa est disponible.",WAVE,beaucoup wav réveiller matin carte visa disponible,POSITIVE,2,7,0.042169047261555175,-0.1911602776199804
459,Vous comptez être une banque ?,WAVE,compter banque,POSITIVE,0,2,-0.045883750247932696,-0.025737801386486108
460,"Wave Côte d'Ivoire
j’ai activé ma carte mais es ce possible de l’avoir aussi physiquement ??",WAVE,wave côte ivoire activer carte physiquement,POSITIVE,1,6,0.3620069693937358,0.03969818799703117
461,"Merci pour la carte virtuelle
Wave Côte d'Ivoire
on est ensemble",WAVE,carte virtuel wave côte ivoire ensembl,POSITIVE,1,6,0.4841641128201275,0.02101233938574699
462,"Wave Côte d'Ivoire
mon combat a cause de vous je ne fais plus de retrait et dépôt ailleurs vous êtes les meilleurs",WAVE,wave côte ivoire combat cause retrait dépôt ailleurs être meilleur,NEUTRAL,1,10,0.2558856516573949,0.10209628396719031
463,Wave c'est toi moi je kiffe,WAVE,wave kiff,POSITIVE,0,2,0.05288596492565124,-0.036679909661596725
464,Quel son les avantages pour les coffre fort?,WAVE,avantage coffre fort,POSITIVE,0,3,-0.06137983499587853,-0.04594874305227018
465,Pourquoi prendre 1% sur le paiement marchand ?,WAVE,prendre paiement marchand,NEGATIVE,0,3,-0.05609481452777804,-0.027550648876385128
467,Vous êtes les meilleurs merci d’avoir dedja nos yeux,WAVE,être meilleur dedjer oeil,POSITIVE,0,4,-0.05693718642674092,0.0027144972941224913
468,"J'attends la disponibilité de ma carte virtuelle
Wave Côte d'Ivoire",WAVE,attendre disponibilité carte virtuel wave côte ivoire,NEGATIVE,1,7,0.5258533628181087,0.024433514104256513
469,"En tout cas, merci pour la révolution. Votre merci ne finira jamais. Seulement continuez à révolutionner ce secteur.",WAVE,cas révolution finir jamais continuer révolutionner secteur,NEGATIVE,0,7,-0.053871236605361424,-0.02283376345372882
470,"Wave Côte d'Ivoire
Dans mon quartier ici à KORHOGO,il prend 100frs pour les retraits inférieur à 5000frs et donne pour justificatif problème de monnaie
Je peux vous transmettre une capture des transactions effectuées chez ce dernier
Maintenant côté Kdo, franchement je n'en ai pas besoin parce que ne pas avoir de Kdo dans la même journée après achats effectués via wave s'est énervant
Le comble, j'ai un Kdo en instance pour un achat de carburant
J'espère que je ne vous ai pas vexé avec mes propos
Pour finir j'ai besoin aussi de la carte visuelle Visa",WAVE,wave côte ivoire quartier ici korhogo prendre retrait inférieur donne justificatif problèm monnaie transmettre capture transaction effectuer dernier côté kdo franchement besoin kdo journée achat effectuer wave énerver comble cadeau instance achat carburant espérer vexer propos finir besoin carte visuel visa,NEGATIVE,0,41,0.14684608640503913,-0.02096784357755553
471,Comment faire pour avoir le numéro de quelqu'un qui a fait un retrait wave sur un téléphone volé svp?,WAVE,faire numéro retrait wav téléphone volé svp,NEGATIVE,0,7,-0.054360619627992775,-0.047450748552553816
472,"J'aimerais savoir quand est ce Nsia banque sera sur wave,il nous fatigue trop les fins de mois",WAVE,aimer savoir nsia banqu wave fatigue trop fin mois,NEUTRAL,0,9,-0.004529523315594283,-0.036149988478146544
473,"Wave Côte d'Ivoire
sciencer dépôt 2k là-bas c'est gâté hein 07_11_52_98_38",WAVE,wave côte ivoire sciencer dépôt gâté hein,POSITIVE,1,7,0.3158478158160781,0.10541344942298501
474,Carte visa de wave là sert à quoi expliquer moi un peu oh je viens de voir sur mon wave ?,WAVE,carte viser wave sert expliquer venir voir wave,POSITIVE,2,8,0.11211295012096434,-0.09808365557395254
475,"Comment retirer ce qui est ds le coffre ?
Et comment obtenir la carte virtuelle ?",WAVE,retirer coffre obtenir carte virtuel,NEGATIVE,2,5,0.0333131438126491,-0.14345197914475377
477,Comment retirer sa carte,WAVE,retirer carte,NEGATIVE,2,2,0.049717644397147834,-0.17016102153032267
478,Je veux avoir ma carte bancaire wave,WAVE,vouloir carte bancaire wav,NEGATIVE,2,4,0.014807290818850396,-0.1492998560460256
480,"Svp privilégier le côté visa concernant la carte cela sera très utile pour la population en général surtout pour les débrouard
Merci pour votre compréhension",WAVE,svp privilégier côté visa carte utile population général débrouard compréhension,POSITIVE,2,10,0.028556968858414928,-0.1470223670576913
481,J'attends toujours mon multicoffre,WAVE,attendre multicoffre,NEUTRAL,0,2,-0.03173652338158019,-0.03579816814750804
482,Avec la carte virtuelle est ce que on peut m faire un virement d’Europe ?,WAVE,carte virtuel faire virement europe,POSITIVE,2,5,0.021408217338900727,-0.13057708524741077
483,Comment faire pour reisi la cat. j'ai là apricatsion suis mon weve,WAVE,faire reisi cat apricatsion weve,NEGATIVE,0,5,-0.0591229213522906,-0.04254742113743633
484,Voyez aussi pour BOA,WAVE,voyez boa,NEUTRAL,0,2,-0.05314355749858606,-0.03624777358862066
485,"Mais nous on faire retrait ici ont paie 100f, dépôt 100f .",WAVE,faire retraire ici payer dépôt,NEGATIVE,0,5,-0.06299617466925454,-0.036140651714137134
486,"Wave Côte d'Ivoire
je veux ma carte virtuelle svp
Vous avez envoyé pour tout le monde sauf moi",WAVE,wave côte ivoire vouloir carte virtuel svp avoir envoyer monde,NEGATIVE,1,10,0.352094418499457,-0.008363938077765566
487,On utilise la carte comment svp,WAVE,utiliser carte svp,POSITIVE,2,3,0.006867831341796452,-0.11399101590601954
488,Habon je vais fais dépôt ooo,WAVE,habon dépôt ooo,NEUTRAL,0,3,-0.05957917336510811,-0.03054539035736397
489,Pensez à la BOA également svp Wave,WAVE,penser boa svp wave,POSITIVE,0,4,0.022803327759007945,-0.04259271765175304
490,"J'ai ma carte virtuelle
depuis 2 mois très pratique à utiliser, j'ai oublié toutes mes cartes prépayées. Soutien total",WAVE,carte virtuel mois pratique utiliser oublier carte prépayer soutien total,POSITIVE,2,10,0.05684386488371533,-0.1538011191733448
491,Comment faire pour avoir la carte visa sur mon appli ?,WAVE,faire carte visa appli,POSITIVE,2,4,0.06544024970586335,-0.2276198433492392
492,Moi j'ai un service de communication donc pour ça je veux faire dépôt retrait wave mais je sais pas comment faire,WAVE,service communication vouloir faire dépôt retraire wav savoir faire,NEUTRAL,0,9,-0.06045037427217302,-0.05164677882155092
493,Aujourd'hui j'ai activé ma carte virtuelle Wave j'adore,WAVE,activer carte virtuel wave adorer,POSITIVE,2,5,0.09372898556241951,-0.13251702014536007
495,Merci #wave d'avoir activer les cartes visa.,WAVE,wave activer carte visa,POSITIVE,2,4,0.14747821519501444,-0.2152172277381431
496,Ont dis donner nous crédit si sa finis ont vas prendre encore,WAVE,dire donner crédit fini prendre,POSITIVE,0,5,-0.04789327454361505,-0.036020601470130406
497,Pourquoi ecobank n'est pas sur la liste des comptes bancaires à lié au compte WAVE ?,WAVE,ecobank liste compte bancaire lier compte wave,NEUTRAL,0,7,-0.0005307766810727819,-0.033015208700523685
498,Vous êtes les meilleurs mais j'ai un soucis j'arrive pas à recharger mon compteur service prépayé avec wave,WAVE,être meilleur souci arriver recharger compteur service prépayer wave,POSITIVE,0,9,-0.0061005276613802575,-0.01726906279380434
499,Et côté prêt là,WAVE,côté prêt,POSITIVE,0,2,-0.04772376642984607,-0.035999717386029945
500,A quand ma carte. J'attends toujours,WAVE,carte attendre,NEGATIVE,2,2,0.028379279611847014,-0.1281583747751207
501,Ma carte est disponible owwwww,WAVE,carte disponible owwwww,NEUTRAL,2,3,0.04413656188230448,-0.14915718588077453
502,"Wave Côte d'Ivoire
,un ami m'a dit une fois, que nous autre qui avons créer un compte wave business, pour une activité pendant les vacances, même si nous utilisons plus le business, dèh lors qu'il à été associé à notre compte normal, n'allons jamais avoir grande somme comment kdo même si nous utilisons wave a tous moments, j'aimerais savoir si celà est vrai.
Perso, ma plus grande récompense est 250,",WAVE,wave côte ivoire ami fois créer compte wave business activité vacance utiliser business dèh être associer compte normal jamais grand somme kdo utiliser wave moment aimer savoir celà vrai perso grand récompense,POSITIVE,0,32,0.16051292841480042,0.029506463864957533
503,"Je dis oh , carte virtuelle la c’est à qui ont donne au juste",WAVE,dire carte virtuel donne,POSITIVE,2,4,0.039131145551899615,-0.14554929034579103
504,Hier chargé canal et on m'a prélevé 5200f je n'ai pas compris.,WAVE,hier charger canal prélever,POSITIVE,0,4,-0.05431358933306624,-0.03155604438751409
506,"Wave Côte d'Ivoire
Bsic.....",WAVE,wave côte ivoire bsic,NEUTRAL,1,4,0.5582674072672068,0.18840451082086596
507,depuis quand les dépôt wave sont gratuits,WAVE,dépôt wav gratuit,POSITIVE,0,3,-0.05382187583024993,-0.061792694760863465
509,Et pour côté de prêt d'argent la,WAVE,côté prêt argent,NEUTRAL,0,3,-0.054780813570867955,-0.02537622581349434
510,Merci wave que de bon chose dans votre vie,WAVE,wave bon chose vie,POSITIVE,0,4,0.02270782158761748,-0.03875188403378018
511,Notre wave chou vous êtes les meilleurs,WAVE,wave chou être meilleur,POSITIVE,0,4,0.029364559678615766,-0.012589182733187269
513,Moi je l'ai déjà c'est vraiment formidable en plus maintenant j'arrive à transférer de l'argent depuis mon compte wave à mon compte bancaire vis versa wave reste la meilleure application de côté d'ivoire,WAVE,vraiment formidable arriver transférer argent compte wav compte bancaire voir verser wave meilleur application côté ivoire,POSITIVE,0,16,0.031164742851754624,-0.00731516353992012
514,On veut qu’il est un code sur les coffres,WAVE,vouloir code coffre,NEGATIVE,0,3,-0.05369466422541096,-0.04735005854866422
515,Big hop a vous,WAVE,big hop,POSITIVE,0,2,-0.05275409473162369,-0.03332214578548083
516,Wave est efficace même ! Merci de nous faciliter la tâche on vous aimes,WAVE,wave efficace faciliter tâche aimer,POSITIVE,0,5,0.013684811752862642,-0.03691746804396585
517,"Bonsoir
Wave Côte d'Ivoire
façon j’ai sécurisé mon argent dans coffre la faut pas après samedi mon argent va disparaître hein .
Merci",WAVE,bonsoir wave côte ivoire sécuriser argent coffre faut samedi argent disparaître hein,NEGATIVE,1,12,0.20626927442187595,0.07652031236169284
518,"Wave prenez ma vie cadeaux
on vous aime beaucoup",WAVE,wave prendre vie cadeal aimer beaucoup,POSITIVE,0,6,0.019960005749197467,-0.038436852321068804
519,La carte Wave ses a fait koi,WAVE,carte wave koi,POSITIVE,2,3,0.07978846394802008,-0.10283021232124503
520,VRAIMENT WAVE CE SONT LES MEILLEURS DES MEILLEURS,WAVE,vraiment wave meilleur meilleurs,POSITIVE,0,4,0.04509751756071504,-0.018479096869093922
521,Mais je dis ho Wave Côte d'Ivoire depuis que j'ai gagné 10k avec vous je n'ai plus gagné même 250f j'ai fait quoi pour mériter cette punition,WAVE,dire wave côte ivoire gagner gagner mériter punition,NEGATIVE,1,8,0.2768520755878506,0.08889013477665103
522,Vous êtes les meilleurs la vie est devenu trop facile avec vous,WAVE,être meilleur vie devenir trop facile,POSITIVE,0,6,-0.054845471332980046,-0.010060050578451062
523,"Nous demandons sg société générale sur les listes dès banque
slvp",WAVE,demander société général liste banque slvp,NEUTRAL,0,6,-0.045464794883531265,-0.02840759821111961
524,Si je dis que je suis pas content de votre apparition j’ai menti merci encore à vous et en plus pour la carte virtuelle,WAVE,dire content apparition mentir carte virtuel,POSITIVE,2,6,0.04071152626632988,-0.1422119535152799
525,"Wave on paye canal+ avec frais maintenant, après on va faire retrait avec frais.c'est comme ça orange nous a eu avec Orange passe 100f",WAVE,wave paye frais faire retrait oranger orange passer,NEGATIVE,0,8,-0.032890520741864875,0.08896421925981067
527,J'ai reçu ma carte virtuelle aujourd'hui merci wave.,WAVE,recevoir carte virtuel wav,POSITIVE,2,4,0.06335495487236936,-0.1791705517337928
528,Moi j'attends toujours ma carte virtuelle,WAVE,attend carte virtuel,POSITIVE,2,3,0.058665963119576836,-0.17427291508842296
529,Comment obtenir la carte visa ?,WAVE,obtenir carte visa,POSITIVE,2,3,0.08013457296155625,-0.24275000590929938
530,Maintenant pourquoi vous prélevez 200fr au niveau du paiement canal+,WAVE,prélever niveau paiement,NEUTRAL,0,3,-0.04860226302490427,-0.0273802700666683
531,Comment lié sont compte Bancaire sgci ??,WAVE,lier compte bancaire sgci,POSITIVE,0,4,-0.05068819318087171,-0.03243685443926606
533,Je souhaiterais que wave côte d'Ivoire pense a la banque bsic aussi pour nous autres.,WAVE,souhaiter wave côte ivoire banque bsic,POSITIVE,1,6,0.3623701028503126,0.12121332836179179
534,Moi j'ai la carte j'ai reçu pr moi ya 4 jour mais je sais pas comment utiliser sa expliquer moi svp,WAVE,carte recevoir jour savoir utiliser expliquer svp,POSITIVE,2,7,0.0021951387395733337,-0.110709796545246
535,Comment on fait pour avoir cette carte,WAVE,carte,POSITIVE,2,1,0.1497619909854402,-0.30237020523839825
536,"Salut comment vous allez
Pour avoir la carte bancaire wave que sont les procédures",WAVE,salut aller carte bancaire wave procédure,POSITIVE,0,6,0.05863419307682485,-0.10369448016358232
537,ouiiiiii wave côte d'ivoire les meilleurs,WAVE,ouiiiiii wave côte ivoire meilleur,POSITIVE,1,5,0.5310870117668413,0.19529070048428082
538,A quand l épargne et le prêt wave,WAVE,épargne prêt wav,NEGATIVE,0,3,-0.048621213254192414,-0.05830986212258767
539,"Wave Côte d'Ivoire
comment fait-on pour activer la carte virtuelle ???",WAVE,wave côte ivoire activer carte virtuel,POSITIVE,1,6,0.4432797110660403,0.013772247471192408
540,Mais les gens prennent 100f avec l'homme toujours,WAVE,prendre homme,POSITIVE,0,2,-0.05833023780213143,-0.036612694695206394
541,Est ce que avec cette carte virtuelle on peut faire achat sur Alibaba,WAVE,carte virtuel faire achat alibaba,POSITIVE,2,5,0.019367728527461738,-0.12972477225146792
542,Dans mon quartier on impose 100fr,WAVE,quartier imposer,POSITIVE,0,2,-0.0548284465553438,-0.034786628328633676
543,"Wave Côte d'Ivoire
le peuple est fière de vous",WAVE,wave côte ivoire peuple fier,POSITIVE,1,5,0.4129588413931258,0.13287089221217016
544,"Merci infiniment de nous simplifier la vie
(Avec wave Tout est facile )",WAVE,infiniment simplifier vie wave facile,POSITIVE,0,5,0.01843463143622506,-0.034877844571721724
545,Je n'ai pas encore voiture mais toujours bonus jusqu'à 1000 sur mon prochain paiement de carburant,WAVE,voitur bonus prochain paiement carburant,POSITIVE,0,5,-0.05595293608509488,-0.033303551441179566
546,Coucou wave est ce possible de pouvoir verrouiller son coffre svp ? Le coffre aussi doit avoir un mot de passe,WAVE,coucou wav pouvoir verrouiller coffre svp coffre mot passer,POSITIVE,0,9,-0.0485899714786502,-0.05311176204158792
547,"Wave Côte d'Ivoire
svp expliquez nous c'est dans quel loge il faut rentrer pour avoir la carte visa de wave ? Tchai",WAVE,wave côte ivoire svp expliquer loge falloir rentrer carte visa wave tchai,NEGATIVE,1,12,0.37338233982761065,-0.05554133493758111
548,Wave svp à quand les puces wave ?,WAVE,wave svp puce wav,POSITIVE,0,4,0.03646369948382512,-0.06465674256177249
549,mais et les cotisations de CMU sont-ils opérationnelle?,WAVE,cotisation cmu opérationnel,POSITIVE,0,3,-0.05100490213538047,-0.034404661673603364
550,Merci wavcoted'ivoire,WAVE,ivoire,NEUTRAL,1,1,0.36435079987436464,0.1553722720327281
551,"Un arnaqueur en direct sur tiktok hinn
Il m'a bloqué
Wave Côte d'Ivoire",WAVE,arnaqueur direct tiktok hinn bloquer wave côte ivoire,NEGATIVE,1,8,0.30322664916349806,0.0984307827738686
552,Wave maintenant vous percevez des frais pour le réabonnement canal,WAVE,wave percevoir frais réabonnement canal,POSITIVE,0,5,0.00866817910353964,-0.036388929696013636
553,"Wave un jour, wave toujours",WAVE,wave jour wave,NEUTRAL,0,3,0.10926021814045118,-0.0376023887684062
554,Vous maintenant on vous comprends là où on besoin de vos services c'est pas le car c'est quand vous allez vendre les unités on n'a plus besoin de ça que tout,WAVE,comprend besoin service aller vendre unité besoin,NEGATIVE,0,7,-0.05775673939081102,-0.03473875434071891
555,"Wave Côte d'Ivoire
votre symbole, c'est un manchot où un pingouin ?",WAVE,wave côte ivoire symbole manchot pingouin,NEGATIVE,1,6,0.4911613639451131,0.1586471673213286
556,J'adore wave,WAVE,adorer wav,POSITIVE,0,2,-0.05307409257773553,-0.07750390056634242
557,C’est SUPER !,WAVE,super,POSITIVE,0,1,-0.05204449660856137,-0.02973903435299309
559,"Wave Côte d'Ivoire
Je t'aime",WAVE,wave côte ivoire aime,POSITIVE,1,4,0.5838468590804627,0.2086311766295556
560,Wave activé carte prépayée la sur mon compte maintenant sa durer hein purée,WAVE,wave activer carte prépayer compte durer hein purer,NEUTRAL,2,8,0.07914104538652551,-0.09266647057676625
561,Wave je vais pas vous donner mon numéro vous aller activer ma carte je doit faire quelle que achat demain,WAVE,wave donner numéro aller activer carte faire achat demain,NEGATIVE,0,9,0.04867637083797613,-0.09098411598317344
562,"Merci beaucoup
vous êtes les meilleurs",WAVE,beaucoup être meilleur,POSITIVE,0,3,-0.04516611761537512,-0.012278898803548181
563,"Mais les frais sur le paiement canal
, on aurait pu avoir une petite notification hein!
Wave Côte d'Ivoire
, je ne vous ai pas connu comme ça hein!",WAVE,frais paiement canal petit notification hein wave côte ivoire connaître hein,NEGATIVE,1,11,0.25374537900121097,0.08702376181123594
564,Nous on est impatients pour l'achat des unités via wave,WAVE,impatient achat unité wave,POSITIVE,0,4,0.028031114726461887,-0.04040531377286006
565,Merci Wave cote d'ivoire,WAVE,wave cote ivoire,POSITIVE,0,3,0.1383778865222383,0.012631078066725494
566,Merci pingouïnou,WAVE,pingouïnou,NEGATIVE,0,1,-0.051871959412641014,-0.03167640228432689
568,Wave merci bien,WAVE,wave bien,POSITIVE,0,2,0.05931351287290995,-0.03520029804936798
569,"Bonjour
Wave Côte d'Ivoire
svp ma carte merci",WAVE,bonjour wave côte ivoire svp carte,POSITIVE,1,6,0.4090323524583934,0.054365443516819455
570,"CMU, CONTRAVENTIONS ET IMPÔTS",WAVE,cmu contravention impôt,NEGATIVE,0,3,-0.05339412951106664,-0.033599057489416044
571,"Wave Côte d'Ivoire
a quand mon compte visa wave ?",WAVE,wave côte ivoire compte visa wave,POSITIVE,1,6,0.6353615378662916,0.08071947792117641
572,"Prenez la peine de débloquer le compte des gens d’abord !!
Depuis Avril compte bloqué et malgré les réquisitions envoyées par le commissariat pour débloquer le compte !!
Et même des personnes du service client me disent que c’est pas normal !!
Le service fraude ne fait donc pas son travail certainement !!
A fuir !!!",WAVE,prendre peine débloquer compte avril compte bloquer réquisition envoyer commissariat débloquer compte personne service client dire normal service fraude travail certainement fuir,NEGATIVE,0,22,-0.06297391837827265,-0.01588526095332755
573,"Wave Côte d'Ivoire
WAVE WAVE, je vous ai appelé combien de fois. Je suis fatigué si vous ne voulez pas me donner la carte ne me donnez plus jamais. On vous appelle vous dites que c'est progressivement nos amis qui reçoivent là leur progressivement est comment et pour nous là c'est comment.
En tous cas je ne suis pas content
.
Cordialement",WAVE,wave côte ivoire wave wave appeler fois fatiguer vouloir donner carte donner jamais appeler dire progressivemer ami recevoir progressivement cas content cordialement,NEGATIVE,1,22,0.23617287652518087,0.005294688871869803
574,est il possible de pouvoir payer le salaire par nos collaborateurs?,WAVE,pouvoir payer salaire collaborateur,NEGATIVE,0,4,-0.05084286656758188,-0.029549816057341537
575,Moi j'attends les puces wave,WAVE,attend puce wav,POSITIVE,0,3,-0.044800502025127295,-0.06828695231204393
576,"Regard comment c'est simple avec
Wave Côte d'Ivoire",WAVE,regard simple wave côte ivoire,NEUTRAL,1,5,0.3941273554493158,0.12958835081462686
577,A quand les impôts ?,WAVE,impôt,NEGATIVE,0,1,-0.054214588827755726,-0.03055900268511153
578,"Partout où il y a paiement
Wave Côte d'Ivoire
je suis partant sinon je bouge",WAVE,partout paiement wave côte ivoire bouger,NEGATIVE,1,6,0.37461994816183786,0.12592594397378334
579,Moi j'attends de pouvoir recharger mon compte PlayStation store en utilisant mon compte wave,WAVE,attend pouvoir recharger compte playstation stor utiliser compte wave,POSITIVE,0,9,0.0032369780749071397,-0.03610443089819132
580,Moi j’attends ma carte visa,WAVE,attend carte visa,NEUTRAL,2,3,0.09506661953612501,-0.2652678422890544
581,Fait vous allez créer votre puce svp,WAVE,aller créer puce svp,POSITIVE,0,4,-0.05505196372661011,-0.038821413049508854
582,"Wave Côte d'Ivoire
Le peuple veut savoir si cela est vrai seulement on va cotiser pour envoyer les gens de ÉVENT LES GARS DE SURPRISE pour vous faire une surprise en guise de remerciement pour ce que vous avez faire pour la population ivoirienne",WAVE,wave côte ivoire peuple vouloir savoir vrai cotiser envoyer évent gars surprise faire surprise guise remerciement avoir faire population ivoirien,NEGATIVE,1,20,0.15253889086125355,0.03616466840317485
583,Merci wave pour mon cadeau de 10k le week- end passé sur mon compte après avoir payer ma facture de 500f par wave dans une surface,WAVE,wav cadeau end passer compte payer facture wave surface,NEUTRAL,0,9,0.01456437883960252,-0.048855500053108555
584,Quand pour la carte CMU,WAVE,carte cmu,POSITIVE,2,2,0.009211539267719735,-0.1180345814400832
585,"Wave je ne veux plus la carte visa.
Depuis combien d'années.je suis fatigué d'attendre.
Wave Côte d'Ivoire",WAVE,wave vouloir carte visa fatiguer attendre wave côte ivoire,NEGATIVE,1,9,0.4411385396612084,-0.053733963113805204
586,Merci wave. On est ensemble jusqu'à la gare,WAVE,wav ensembl gare,POSITIVE,0,3,-0.04533896497544513,-0.05886118580452549
587,Moi je n'arrive plus à vous par le1315,WAVE,arriver,POSITIVE,0,1,-0.053594127545593444,-0.03146911177827298
