Unnamed: 0,comments,Service,clean_sentence,sentiment,cluster,nb_mots,x,y
1726,"Moi j'ai dépassé étape critique là, je suis à l'étape ni Allah sonna",Orange Money,dépasser étape critique étape allah sonna,NEGATIVE,0,6,-0.052671708636234646,-0.033531589252587736
1727,À part 200% mettez dans 454 aussi tchai,Orange Money,part mettre tchai,NEGATIVE,0,3,-0.056308512709017454,-0.03240333869634272
1728,"Moi j'ai pas connu cette épidémie de janviose.
Merci Seigneur",Orange Money,connaître épidémie janviose seigneur,POSITIVE,0,4,-0.05589225923413006,-0.03787081657614567
1729,Il n'y a pas pour évanouissement pffffff,Orange Money,évanouissement pffffff,POSITIVE,0,2,-0.051871959412641014,-0.03167640228432689
1731,"Pour moi la on dirait c’est mardi bonus hein
Ouais 200% de bonus même",Orange Money,dire mardi bonus hein ouai bonus,POSITIVE,0,6,-0.058478108763414485,-0.030410609582793756
1733,Galère critique,Orange Money,galère critique,NEUTRAL,0,2,-0.06482050958501809,-0.03945176053604818
1734,"Je retiens le +454 sur l'image
Patrick Wilfried N'Gatta
oubien",Orange Money,retenir image patrick wilfried gatta oubien,POSITIVE,0,6,-0.05591023886911481,-0.0367706977987147
1736,"Je suis derrière le rouge, je crois bien 150%
. Je dois même ehhh pardonner laisser mon crédit là",Orange Money,rouge croire bien devoir ehhh pardonner crédit,NEGATIVE,0,7,-0.057052639352671713,-0.031188415248114647
1737,75% Dieu gère,Orange Money,dieu gérer,POSITIVE,0,2,-0.06175551098454349,-0.030793529064219703
1740,Quand je regarde dans tout çala ya pas pour moi dedans par ce que moi mon cas là m'inquiète,Orange Money,regarder çala cas inquiet,POSITIVE,0,4,-0.052094015139481656,-0.03390620490000276
1742,Y a pas thermomètre de bœuf là-bas ??? Je tiens plus,Orange Money,thermomètre bœuf,POSITIVE,0,2,-0.05514377456665308,-0.03522543505770479
1743,État sévèrement critique forte possibilité d’un comas,Orange Money,état sévèrement critique fort possibilité coma,NEGATIVE,0,6,-0.07410325747571472,-0.04482291507406816
1744,Pour moi est 87% comme pour tam sir là,Orange Money,tam sir,NEUTRAL,0,2,-0.051871959412641014,-0.03167640228432689
1746,1000%: Sérieusement atteint,Orange Money,sérieusement atteindre,POSITIVE,0,2,-0.05463945316055437,-0.034120936294059684
1748,orange même a tout gâter,Orange Money,oranger gâter,POSITIVE,0,2,-0.07135037824121496,-0.015490053844996654
1749,Il n'y a pas noir après le rouge là par hasard ??,Orange Money,noir rouge hasard,NEUTRAL,0,3,-0.05667916780003667,-0.032729632658643704
1750,Je sais plus où me mettre offerte...mon état ne figure pas sur le thermomètre,Orange Money,savoir mettre offrir état figurer thermomètre,POSITIVE,0,6,-0.06251130903425943,-0.033141626109061725
1751,"Après état critique là ce qui vient là c'est mon cas tchiaaa
!!!",Orange Money,état critique venir cas tchiaaa,NEGATIVE,0,5,-0.07167244958362215,-0.042220607178897286
1752,Genre pour moi n'ai pas afficher sur ça hein,Orange Money,genre afficher hein,POSITIVE,0,3,-0.04992910751418779,-0.018791441593515094
1754,Je ne vois pas pour moi dedans inh,Orange Money,voir inh,NEUTRAL,0,2,-0.05689876073293454,-0.03531774873231764
1755,Votre affaire de coffre fort 1 mois là vraiment ressayer de voir ça hein,Orange Money,affaire coffre fort mois vraiment ressayer voir hein,NEGATIVE,0,8,-0.05880884419508404,-0.03332665674289663
1756,Comment envoyer de l'argent vers la Guinée Conakry via orange money,Orange Money,envoyer argent guinée conakry orange money,NEGATIVE,3,6,-0.13142092859739862,0.26068157152654375
1757,"Moi c'est fais des Anne que je faire des transactions avec Orange Money oui je dis bien des Années et pour un prêt que je veux a Orange Banque
en me parle de ke ne c'est quoi le profil n'ai pas gnin gnin gnin",Orange Money,anne faire transaction orange money oui dire bien année prêt vouloir orange banque profil gnin gnin gnin,POSITIVE,3,17,-0.12275901022292707,0.24272594193768696
1758,Je n’arrive pas à créer mon compte orange money,Orange Money,arriver créer compte oranger money,NEGATIVE,0,5,-0.09968508470262637,0.10093486586537839
1759,Avec orange Money on règle problème au village,Orange Money,orange money régler problème village,NEUTRAL,3,5,-0.14629962226544918,0.3175523445336681
1760,Maintenant les 100f on prend la c’est pour quoi au juste expliquer nous parce que nous on comprend pas,Orange Money,prendre expliquer comprendre,POSITIVE,0,3,-0.0570954704560082,-0.03499074687394783
1761,Je t'aime ma maman cherie,Orange Money,aimer maman cherie,POSITIVE,0,3,-0.05545710235035057,-0.03250325719689319
1762,"Vazoumana Bamba
mon boss",Orange Money,vazoumana bamba boss,POSITIVE,0,3,-0.051526480325333135,-0.028175638195380364
1763,Svp comment sa se passe pour le l'épargne OM,Orange Money,svp passer épargne,NEGATIVE,0,3,-0.05636379355799503,-0.042627098724117074
1764,Comment obtenir vos APIs ?,Orange Money,obtenir api,POSITIVE,0,2,-0.04937999559294723,-0.04191965985369187
1765,Maintenant Orangina qu'il a donner la à koi avoir avec la publicité,Orange Money,orangina donner koi publicité,NEGATIVE,0,4,-0.04666514505386785,-0.037836486736397966
1766,"Hassane Kone
début de la vidéo la rappelle moi c’est le son de qui stp je sais que c’est youssoupha mais avec qui là je sais pas",Orange Money,hassane kone début vidéo rappelle stp savoir youssoupha savoir,NEUTRAL,0,9,-0.05521219258171609,-0.029529182680153625
1767,"Nourdine Timite
djaaa on a une star à nos côtés",Orange Money,nourdine timite djaaa star côté,NEUTRAL,0,5,-0.050064244480650937,-0.036598219580796294
1768,Orange money souvent les commissions ne viennent pas,Orange Money,orange money commission venir,POSITIVE,3,4,-0.17510843904426307,0.4419315449938571
1769,Vraiment merci crédit avc sans pression,Orange Money,vraiment crédit avc pression,POSITIVE,0,4,-0.04754185549631351,-0.029502962983181023
1770,Qui a reconnu la voix de Kévin obin dans la narration ?,Orange Money,reconnaître voix kévin obin narration,POSITIVE,0,5,-0.053589568331830865,-0.03194771728783486
1771,C’est la janviose actu,Orange Money,janviose actu,POSITIVE,0,2,-0.054624398794202084,-0.03460122794380318
1772,Fofana Abou,Orange Money,fofana abou,NEUTRAL,0,2,-0.053209426671358265,-0.03314477784816103
1773,"Bonjour
Mam Camara
, courage plus que 7 jours. Sinon y'a Tik Tak hein",Orange Money,bonjour mam camara courage jour tik tak hein,NEUTRAL,0,8,-0.059857597204578256,-0.017989186852110928
1774,Ha donc c'est bien une stratégie des banques et des opérateurs financiers de ne mettre en circulation que des grosses coupures aux déends des pièces et des billets. Pour pouvoir gratter sa part sur chaque transaction comme le plus vile usurier biblique.,Orange Money,bien stratégie banque opérateur financier mettre circulation grosse coupure déend pièce billet pouvoir gratter part transaction vil usurier biblique,NEUTRAL,0,19,-0.051794880408275235,-0.025533003507467924
1775,"""Tu vas chercher monnaie jusqu'en Janvier ""
Orange Money",Orange Money,chercher monnayer janvier orange money,NEUTRAL,3,5,-0.13528119502841432,0.28825210126367967
1776,"C'est ça hein, payons avec OM c'est plus simple et sans problème.",Orange Money,hein payon simple problème,NEUTRAL,0,4,-0.05497501426984593,-0.015588707253442932
1777,"... Faut les laisser on vas les associés ils vont comprendre.
Orange Money",Orange Money,falloir associé comprendre orange money,NEGATIVE,3,5,-0.15167363205710813,0.3601660315085348
1778,Cm tu cri sur eux fort hein,Orange Money,cri fort hein,POSITIVE,0,3,-0.059020180996953844,-0.03125432987583875
1779,"Orange Money
bjr à vous j ai besoin du lien pour télécharger l application OM merci",Orange Money,orange money bjr besoin lien télécharger application,NEGATIVE,3,7,-0.12186095139914832,0.2336803546692359
1780,"Moi même autre fois j'ai cherché monnaies du grand marché d'adjamé jusqu'à port bouét. heureusement que j'ai eu la solution avec
Orange Money",Orange Money,fois chercher monnayer grand marché adjamé port bouét heureusement solution orange money,POSITIVE,3,12,-0.10818938290686962,0.18857554258417267
1781,Forcément,Orange Money,forcément,NEGATIVE,0,1,-0.055238050500578555,-0.034420648444556536
1782,Je n'arrive pas à configurer l'application Max it,Orange Money,arriver configurer application max,POSITIVE,0,4,-0.05887294001898695,-0.025293532442921703
1783,"En tout cas moi j’ai jouer et je compte gagner
Orange
avec le goat des réseaux y’a pas poto",Orange Money,cas jouer compte gagner orange goat réseau poto,NEUTRAL,0,8,-0.09222806467577908,0.09734333437156976
1784,"Orange
mais les pass suprise ne passe pas pourtant vous envoyer les messages ahhii",Orange Money,orange pass suprise passer pourtant envoyer message ahhii,NEGATIVE,0,8,-0.08866548233432407,0.07904246434525965
1785,Heuu c'est moi seul ? Ma puce orange ne passe plus,Orange Money,heuu puce oranger passer,NEUTRAL,0,4,-0.07527658084871826,-0.012631467487215506
1786,"Marius M'bra
DJhon Marc Marvel",Orange Money,marius brer djhon marc marvel,POSITIVE,0,5,-0.051871959412641014,-0.03167640228432689
1787,Ou sont les résultats des jeux passés ?,Orange Money,résultat jeu passer,NEUTRAL,0,3,-0.06732897854586276,-0.018183479889503605
1788,J'ai l'application mais comment faire pour jouer,Orange Money,application faire jouer,POSITIVE,0,3,-0.06053037489720894,-0.035534559289721025
1789,"Franchement expliquez bien ce jeu sur Max it.
Malgré les indices je ne vois toujours pas.
Un exemple pourait aider plusieurs comme moi.",Orange Money,franchement expliquer bien jeu max indice voir exemple pourer aider,POSITIVE,0,10,-0.061785004429716156,-0.02882761280901445
1790,"Je dis oh orange, pourquoi vous démagnétisez les puces sans avertissement ?
Vous nous faîtes perdre de l'argent en faisant ainsi... Pourquoi cette mauvaise manière ?",Orange Money,dire orange démagnétiser puce avertissement faîter perdre argent mauvais manière,NEGATIVE,0,10,-0.08149132952229493,0.06859144660214374
1791,Orange vous avez quel soucis un coup comme ça ma puce affiche aucun service aïe,Orange Money,orange avoir souci coup puce affiche aucun service aïe,NEGATIVE,0,9,-0.08233888285179347,0.06927368432818781
1792,L'application ne fonctionne pas chez moi,Orange Money,application fonctionner,POSITIVE,0,2,-0.05324389050553689,-0.02653905645879199
1793,C'est pas cadeau de fin d'année qui est là là,Orange Money,cadeau fin année,POSITIVE,0,3,-0.04746883442325061,-0.032482801084608805
1794,"Orange
j’ai reçu ces messages depuis avant hier et j’arrive toujours pas à souscrire car lorsque je fais la syntaxe on me dit aucun pass disponible",Orange Money,orange recevoir message hier arriver souscrire syntaxe aucun pass disponible,NEGATIVE,0,10,-0.07394796111866733,0.0503190056201889
1795,Ont voir jamais les résultats de vos jeux,Orange Money,voir jamais résultat jeu,NEGATIVE,0,4,-0.06608811600001743,-0.01768953156878484
1796,Frankadiva Ouattara,Orange Money,frankadiva ouattara,NEUTRAL,0,2,-0.054632776773808206,-0.03468892207297391
1797,Seul les durs s’en sortiront,Orange Money,dur sortir,NEGATIVE,0,2,-0.05426807319162162,-0.02870132950138946
1798,"Orange
comment faire le numéro complice ??",Orange Money,orange faire numéro complice,NEGATIVE,0,4,-0.09029802102205728,0.0919511316828133
1799,"J’ai payé ma depuis le samedi passé, de vous demander pardon avant que vous ne veniez l’installer ?",Orange Money,payer samedi passer demander pardon venir installer,NEGATIVE,0,7,-0.053554373637328415,-0.033239248002087524
1800,On ne voit jamais le gagnant,Orange Money,voir jamais gagnant,POSITIVE,0,3,-0.06380764895925649,-0.029816444891498723
1801,Comment on joue ?,Orange Money,joue,POSITIVE,0,1,-0.05447664255254273,-0.03365140683931623
1802,Nguessan Erika,Orange Money,nguessan erika,NEUTRAL,0,2,-0.051871959412641014,-0.03167640228432689
1803,C’est pas du jeu inh ! Mais on est dedans !!!,Orange Money,jeu inh,POSITIVE,0,2,-0.06076170384480056,-0.02857508566058054
1804,"Félicitations à nos gagnants !
YOUNGA YACOUBA
ABI GOSSI DORCAS EPSE YANKEY GUINDO HUSSEN HUGUES JUNIOR SANOGO LADJI MAMADOU
YAO NISSI ARIELLE FRANCESCA
AHOUA GUIRO EPOUSE KEITA
SANE MOUSSA
ZAHUI JEAN YVES STEPHANE
BANE MOHAMED LAMINE
DIGBEU KOUELI BI SERY ANGE",Orange Money,félicitation gagnant younga yacouba abi gossi dorcas epse yankey guindo hussen hugue junior sanogo ladji mamadou yao nissi arielle francesca ahoua guiro epouse keita sane mousser zahui jean yves stephane bane mohamed lamine digbeu koueli sery ange,POSITIVE,0,37,-0.05860900240730187,-0.033518177081151186
1805,"Orange vole date des gens
Ils viennent de mettre nouvelle règle soit disant que tu renouvelle pas des data avant 3 jours il coupe au lieux de une semaine pour les autre service.
D’après il commence sa début janvier",Orange Money,orange vole date venir mettre nouveau règle dire renouvell data jour coupe lieu semaine service commencer début janvier,NEGATIVE,0,18,-0.07817034830689071,0.03493060707330253
1806,C’est frappe hors,Orange Money,frappe,NEUTRAL,0,1,-0.051871959412641014,-0.03167640228432689
1807,Comment on fait pour gagner ?,Orange Money,gagner,POSITIVE,0,1,-0.046690326667284676,-0.025080110752746052
1808,C'est Dôhi,Orange Money,dôhi,NEUTRAL,0,1,-0.05451913744940301,-0.030676153655147344
1809,Boukary n'es jamais consentrer,Orange Money,boukary jamais consentrer,NEGATIVE,0,3,-0.06263685963331213,-0.018276711431482788
1810,les gagnants sont les même travailleurs,Orange Money,gagnant travailleur,POSITIVE,0,2,-0.06007052610274246,-0.03985225878032087
1811,"C’est mise en scène
depuis y’avait 10 ans le premier numéro a été toujours orange jusqu’aujourd’hui même bic d’orange j’ai jamais reçu j’ai toujours fait les paiements orange mais rien",Orange Money,mettre scène numéro être oranger bic oranger jamais recevoir paiement orange rien,NEGATIVE,0,12,-0.09074987865127793,0.07811407526161268
1812,C'est dohi. Depuis on fait payement retrait et tout la. On n'a jamais été bipé par Orange,Orange Money,dohi payement retrait jamais être biper orange,NEGATIVE,3,7,-0.09934317478406475,0.11130448263920682
1813,heeeee on souffre hooo,Orange Money,heeeee souffrir hooo,NEGATIVE,0,3,-0.05126099890573145,-0.02882449665645942
1814,"Pour avoir une puce marchand on doit maître dès mois
Orange Money",Orange Money,puce marchand maître mois orange money,POSITIVE,3,6,-0.14008539330682226,0.3028920273985589
1815,Du n’importe quoi vous prenez vos parents pour leurs offrir des kd2 des bêtises je fais la plus part de mes payements avec OM mais jamais j’ai été récompensé,Orange Money,prendre parent offrir bêtise part payement jamais être récompenser,NEGATIVE,0,9,-0.060262068156072116,-0.02057497418909621
1816,"Orange Money
les esim d’orange sont disponibles dans vos agence ???",Orange Money,orange money esim oranger disponible agence,POSITIVE,3,6,-0.17632773927518267,0.41769139418181406
1817,Ok pour l'information,Orange Money,information,POSITIVE,0,1,-0.05301680793420064,-0.03315577060308961
1818,On donne les 2gigas à chaque fois qu'on paye les factures,Orange Money,donne fois payer facture,NEGATIVE,0,4,-0.05533358284279099,-0.0337815829768994
1819,"Comment se passe pour le payement des clients CIE prépayée ?
Je n'arrive pas a payer sur Max it",Orange Money,passer payement client cie prépayer arriver payer max,NEGATIVE,0,8,-0.04845322946045832,-0.03152915523912351
1820,Svp j'ai rechargé mon compte cie et j'ai supprimé le message sans le savoir comment faire pour le récupérer,Orange Money,svp recharger compte supprimer message savoir faire récupérer,NEGATIVE,0,8,-0.05559799960850037,-0.03529074998991462
1821,"Super,mais dite au gérant d'orange Money d'arrêter de prendre toujours les 100f, lorsqu'on va faire un dépôt sur Yamoussoukro.",Orange Money,super gérant orange money arrêter prendre faire dépôt yamoussoukro,POSITIVE,3,9,-0.1310680872017022,0.24052203711881648
1822,Et facture prépayé cie on va bénéficier du bonus aussi,Orange Money,factur prépayer cie bénéficier bonus,POSITIVE,0,5,-0.045622517144091615,-0.03865537418982018
1823,S'il vous plaît je peux recevoir de l'argent de l'Algérie par orange money ?,Orange Money,plaire recevoir argent algérie orange money,NEGATIVE,3,6,-0.15476611953838734,0.38169225270784407
1824,"Donc la fibre optique n'est pas concernée ? Vous voyez votre vie, négliger vos produit au profit des autres. 0 système marketing",Orange Money,fibre optique concerner voir vie négliger produit profit système marketing,NEGATIVE,0,10,-0.05522167083703973,-0.028434443923905726
1825,Moi j’ai rechargé mon Easybox j’ai pas reçu de bonus,Orange Money,recharger easybox recevoir bonus,POSITIVE,0,4,-0.0503269956781849,-0.04394257246084437
1826,"j'ai fait paiement d facture aujourd'hui je n'ai rien eu ,comment ça s'explique??",Orange Money,paiement facture rien expliquer,NEGATIVE,0,4,-0.05471272418467243,-0.030144359199614845
1827,Valable combien de jours,Orange Money,valable jour,NEUTRAL,0,2,-0.057056735737381015,-0.03273436650055249
1828,Meilleur réseau de téléphonie mobile,Orange Money,meilleur réseau téléphonie mobile,POSITIVE,0,4,-0.06183517084073377,-0.003596667508275579
1829,Ça a commencé quand?,Orange Money,commencer,POSITIVE,0,1,-0.05219071113004625,-0.040268531678067
1830,Les 5 % s’applique à quel paiement sinon j’ai fais plein de paiement ou j’ai rien reçu,Orange Money,applique paiement plein paiement rien recevoir,NEGATIVE,0,6,-0.04826560197332073,-0.030422607272288155
1832,Les vtc son éligible ?,Orange Money,vtc éligible,POSITIVE,0,2,-0.05393774401257472,-0.03250986894548226
1833,Bonjour depuis une semaine mon application Max it ne fonctionne je n’arrive pas à accéder dedans,Orange Money,bonjour semaine application max fonctionner arriver accéder,POSITIVE,0,7,-0.05942447904946108,-0.02366352175937938
1834,"Depuis le 16 décembre, ma connexion fibre est coupée malgré le renouvellement de mon abonnement. Service client injoignable, et aucune intervention après ma réclamation en agence. C’est inadmissible ! Je demande le rétablissement immédiat et un dédommagement.",Orange Money,décembre connexion fibr couper renouvellement abonnement service client injoignable aucun intervention réclamation agence inadmissible demande rétablissement immédiat dédommagement,NEGATIVE,0,18,-0.06500157001655266,-0.020494496482703514
1835,J’ai fais des achats j’ai pas reçu les 5 %,Orange Money,achat recevoir,POSITIVE,0,2,-0.03309177444840805,-0.052554032147732355
1836,1 ROI DU MONDE,Orange Money,roi monde,POSITIVE,0,2,-0.050062017573074685,-0.04608363621598848
1837,"Orange aujourd’hui
Orange demain
Orange toujours
Orange Les meilleurs",Orange Money,orange orange demain orange orange meilleur,POSITIVE,3,6,-0.14790729644834646,0.3333127421031933
1838,Bonsoir mon ami orange c'est COOL,Orange Money,bonsoir ami oranger cool,POSITIVE,0,4,-0.06856284729529792,-0.02062869850497092
1840,Roro Levi,Orange Money,roro levi,NEGATIVE,0,2,-0.051871959412641014,-0.03167640228432689
1842,On attends les 5% de remboursement sur les courses vtc car c’est décembre et on bouge beaucoup,Orange Money,attend remboursement course vtc décembre bouger beaucoup,NEGATIVE,0,7,-0.04210710752991175,-0.040333034699309794
1843,C'est pas mieux vous allez payer en même temps,Orange Money,mieux aller payer temps,NEGATIVE,0,4,-0.05389828899898597,-0.029931220409681537
1844,Wave merci grâce à toi,Orange Money,wave grâce,POSITIVE,0,2,0.0633553093178699,-0.039865961134551355
1847,"Orange , pourquoi votre service clientèle ne passe jamais ! Revoyez ce côté là svp! J’ai fini de payer mon crédit sur mon compte principal, mais je suis tjrs débite lorsque je fais des transferts !",Orange Money,orange service clientèl passer jamais revoyez côté svp finir payer crédit compte principal tjrs débiter transfert,NEGATIVE,0,16,-0.07913739941259788,0.055358962096432165
1848,Vous la ça tombe bien je vous cherchais je n'ai pas pris de crédit sur ma puce orange qui est une puce flotte je fais transfert 500 vous me retirez 400 Que gningnin de SOS crédit c'est bien en tout cas puce la va rester comme ça parce que si c'est pas vos 2500 de transfert de fin du mois la la moi je vais plus jahin faire transfert encore,Orange Money,tombe bien cherchai prendre crédit puce oranger puce flotte transfert retirer gningnin sos crédit bien cas puce rester transfert fin mois jahin faire transfert,NEGATIVE,0,24,-0.06753001881354918,-0.02337573958720293
1849,"Bonjour Orange ça fait bientôt 2 mois que vos commerciaux m’ont harcelé pour que je prenne la fibre , depuis rien , j’ai payé personne ne vient installer
C’est vraiment dommage",Orange Money,bonjour orange bientôt mois commercial harceler prendre fibre rien payer venir installer vraiment dommage,NEGATIVE,0,14,-0.07979887254684608,0.061633437315136916
1851,S’il vous plaît vous avez Samsung galaxie A15 dans votre boutique ?,Orange Money,plaire avoir samsung galaxie boutique,POSITIVE,0,5,-0.05025297633663081,-0.027921807929576475
1852,À quand les résultats ?,Orange Money,résultat,POSITIVE,0,1,-0.06102212555906417,-0.01753894365760941
1854,"Orange
j'ai un soucis svp.
Repondez moi en inbox",Orange Money,orange souci svp repondez inbox,NEGATIVE,3,5,-0.09027490365169466,0.10377222119936926
1855,C'est illimité le réabonnement coût combien par mois aussi,Orange Money,illimiter réabonnement coût mois,NEGATIVE,0,4,-0.055449051791002395,-0.03071364528916836
1856,"Orange, donnez mon argent si vous plaît.",Orange Money,orange donner argent plaire,NEGATIVE,0,4,-0.08809287563352004,0.10402836435875468
1857,Indice,Orange Money,indice,POSITIVE,0,1,-0.05312717778516788,-0.03292633702270745
1858,"Comment on joue,je ne comprends pas",Orange Money,joue comprendre,POSITIVE,0,2,-0.05600362897001487,-0.03205788071376345
1859,Cette fois sera la bonne,Orange Money,fois bon,POSITIVE,0,2,-0.05758678973880148,-0.030824919162307042
1860,"Orange Money
votre fibre ne fonctionne plus correctement ??? Je suis fatiguée hein
Si jusqu'en janvier 2025 ça continue
Je vais aller chez mes autres
Franchement c'est abusé",Orange Money,orange money fibre fonctionner correctement fatiguer hein janvier continuer aller franchement abuser,NEUTRAL,3,12,-0.11960495656235982,0.22865267619335747
1861,"Depuis trois jours je joue seulement,je vois rien Oubien c’est entre vous la bas???",Orange Money,jour joue voir rien oubien,POSITIVE,0,5,-0.059452176136738116,-0.03250395930408266
1862,"Orange Money
les résultats sortent quand s'il vous plaît ?",Orange Money,orange money résultat sortir plaire,NEGATIVE,3,5,-0.14689892467761081,0.33715335204625263
1863,"Bonjour m/Mme, Etant un client fidèle d'orange je tiens à vous exprimer ma déception profonde par vos services internet fibre.
Je suis abonné depuis bientôt 1 an à la fibre optique orange. Je payais régulièrement mes factures malgré les problèmes de connexion. depuis 2 semaines environ, j'ai été suspendu sans raison pourtant je suis à jour dans le règlement de facture.
J'ai soumis ce problème à l'agence, ils ont reconnu le problème et prit ma réclamation en compte en me rassurant qu'on allait résoudre le problème dans 48h maximum. Voilà maintenant 12 jours que j'ai ce problème et rien n'a été fait encore jusqu'ici. Le service client orange me sort un baratin comme quoi c'est une anomalie du serveur et que des techniciens sont entrain de résoudre.
Je passe par cette plate-forme pour informer que je m'apprête à exposer les fait sur les réseaux sociaux si rien n'est fait jusqu'içi.",Orange Money,bonjour mme client fidèle orange exprimer déception profond service internet fibre abonner bientôt fibre optique orange payer régulièrement facture problème connexion semaine être suspendre raison pourtant jour règlement facture soumettre problème agence reconnaître problème prendre réclamation compte rassurer aller résoudre problème maximum jour problème rien être ici service client oranger sortir baratin anomalie serveur technicien entrain résoudre passer plate forme informer apprêter exposer réseau social rien içi,NEGATIVE,0,67,-0.09517501031131216,0.06084157553210924
1864,Le service Orange client ou technique est nul pour un retrait de puce je à mon près d'un mois de faut revenir demain,Orange Money,service orange client technique retrait puce mois faut revenir demain,NEGATIVE,0,10,-0.08692696831284076,0.07859275179538561
1865,Jeux la aussi on joue toujours mais pas de résultat,Orange Money,jeu joue résultat,POSITIVE,0,3,-0.06438056967499886,-0.018782024828464042
1866,"Félicitations à nos gagnants !
BONZOU BADUA NANCY MARYSE
KOFFI JACQUES EVELYNE AMOIN
COULIBALY YELLI AUDREY
DIAW KEWEADAMNAIMA
DAGNOGO ADAMA
OUATTARA ZODJE DRAMANE
KOUASSI KAN SIDNEY
KOUYATE ZIE VALY
N'GUESSAN KOUAKOU CESAR
ACHIEDOH EPOUSE YAVO
CHIASTE FLORENCE",Orange Money,félicitation gagnant bonzou badua nancy maryse koffi jacques evelyne amoin coulibaly yelli audrey diaw keweadamnaima dagnogo adama ouattara zodje dramane kouassi kan sidney kouyate zie valy guessan kouakou cesar achiedoh epouse yavo chiaste florence,POSITIVE,0,34,-0.05999769255920753,-0.03564308616140915
1867,Je penses qu'il faut permettre au participants de savoir ou du moins de connaître les gagnants ou non pour une question de clarté dans le jeu,Orange Money,penser falloir permettre participant savoir connaître gagnant non question clarté jeu,NEUTRAL,0,11,-0.060519266757759795,-0.02904736887979488
1869,"Orange Money
y, bonne année à vous mais je n'ai toujours pas reçu la récompense de la chasse au trésor, faites quelque chose svp",Orange Money,orange money bon année recevoir récompense chasse trésor fait chose svp,POSITIVE,3,11,-0.11216820072442912,0.18521908642899182
1870,Bonjour votre box orange coût combien,Orange Money,bonjour box oranger coût,NEUTRAL,0,4,-0.06539954118589111,-0.014929042601314894
